RTE,GLOUCESTERSHIRE HOSPITALS NHS FOUNDATION TRUST,NHS Trust,GL53 7AN,South West,true,202104,202606,63,true,QR1,NHS Gloucestershire Integrated Care Board,QR1,NHS Gloucestershire Integrated Care Board
RM3,NORTHERN CARE ALLIANCE NHS FOUNDATION TRUST,NHS Trust,M6 8HD,North West,true,202104,202606,63,true,QOP,NHS Greater Manchester Integrated Care Board,QOP,NHS Greater Manchester Integrated Care Board
RET,THE WALTON CENTRE NHS FOUNDATION TRUST,NHS Trust,L9 7LJ,North West,true,202104,202606,0,false,QYG,NHS Cheshire And Merseyside Integrated Care Board,QYG,NHS Cheshire And Merseyside Integrated Care Board
RFF,BARNSLEY HOSPITAL NHS FOUNDATION TRUST,NHS Trust,S75 2EP,North East and Yorkshire,true,202104,202606,63,true,QF7,NHS South Yorkshire Integrated Care Board,QF7,NHS South Yorkshire Integrated Care Board
NDJ,FIRST COMMUNITY HEALTH AND CARE CIC,Other provider,,South East Commissioning Region,,202104,202606,0,false,QNX,NHS Sussex Integrated Care Board,QNX,NHS Sussex Integrated Care Board
NDA57,HASLEMERE MINOR INJURIES UNIT,Other provider,,South East Commissioning Region,,202104,202312,0,false,QXU,NHS Surrey Heartlands Integrated Care Board,QXU,NHS Surrey Heartlands Integrated Care Board
RK9,UNIVERSITY HOSPITALS PLYMOUTH NHS TRUST,NHS Trust,PL6 8DH,South West,true,202104,202606,63,true,QJK,NHS Devon Integrated Care Board,QJK,NHS Devon Integrated Care Board
RKB,UNIVERSITY HOSPITALS COVENTRY AND WARWICKSHIRE NHS TRUST,NHS Trust,CV2 2DX,Midlands,true,202104,202606,63,true,QWU,NHS Coventry And Warwickshire Integrated Care Board,QWU,NHS Coventry And Warwickshire Integrated Care Board
RXF,MID YORKSHIRE TEACHING NHS TRUST,NHS Trust,WF1 4DG,North East and Yorkshire,true,202104,202606,63,true,QWO,NHS West Yorkshire Integrated Care Board,QWO,NHS West Yorkshire Integrated Care Board
RBD,DORSET COUNTY HOSPITAL NHS FOUNDATION TRUST,NHS Trust,DT1 2JY,South West,true,202104,202606,63,true,QVV,NHS Dorset Integrated Care Board,QVV,NHS Dorset Integrated Care Board
RJN,EAST CHESHIRE NHS TRUST,NHS Trust,SK10 3BL,North West,true,202104,202606,63,true,QYG,NHS Cheshire And Merseyside Integrated Care Board,QYG,NHS Cheshire And Merseyside Integrated Care Board
RHW,ROYAL BERKSHIRE NHS FOUNDATION TRUST,NHS Trust,RG1 5AN,South East,true,202104,202606,63,true,QU9,"NHS Buckinghamshire, Oxfordshire And Berkshire West Integrated Care Board",QU9,"NHS Buckinghamshire, Oxfordshire And Berkshire West Integrated Care Board"
RR8,LEEDS TEACHING HOSPITALS NHS TRUST,NHS Trust,LS9 7TF,North East and Yorkshire,true,202104,202606,63,true,QWO,NHS West Yorkshire Integrated Care Board,QWO,NHS West Yorkshire Integrated Care Board
RDE,EAST SUFFOLK AND NORTH ESSEX NHS FOUNDATION TRUST,NHS Trust,CO4 5JL,East of England,true,202104,202606,63,true,QJG,NHS Suffolk And North East Essex Integrated Care Board,QJG,NHS Suffolk And North East Essex Integrated Care Board
RDR,SUSSEX COMMUNITY NHS FOUNDATION TRUST,NHS Trust,BN2 3EW,South East,true,202104,202606,0,false,QNX,NHS Sussex Integrated Care Board,QNX,NHS Sussex Integrated Care Board
RW4,MERSEY CARE NHS FOUNDATION TRUST,NHS Trust,L34 1PJ,North West,true,202104,202606,0,false,QYG,NHS Cheshire And Merseyside Integrated Care Board,QYG,NHS Cheshire And Merseyside Integrated Care Board
RXR,EAST LANCASHIRE HOSPITALS NHS TRUST,NHS Trust,BB2 3HH,North West,true,202104,202606,63,true,QE1,NHS Lancashire And South Cumbria Integrated Care Board,QE1,NHS Lancashire And South Cumbria Integrated Care Board
AJN,WORKINGTON HEALTH LIMITED,Other provider,,North East and Yorkshire Commissioning Region,,202104,202606,0,false,QHM,NHS North East And North Cumbria Integrated Care Board,QHM,NHS North East And North Cumbria Integrated Care Board
NNF76,THE WILBERFORCE HEALTH CENTRE,Other provider,,North East and Yorkshire Commissioning Region,,202104,202402,0,false,QOQ,NHS Humber And North Yorkshire Integrated Care Board,QOQ,NHS Humber And North Yorkshire Integrated Care Board
AD913,BECKENHAM BEACON UCC,Other provider,,London Commissioning Region,,202104,202606,0,false,QKK,NHS South East London Integrated Care Board,QKK,NHS South East London Integrated Care Board
Y02428,PUTNOE WALK IN CENTRE,Other provider,,East of England Commissioning Region,,202104,202606,0,false,QHG,"NHS Bedfordshire, Luton And Milton Keynes Integrated Care Board",QHG,"NHS Bedfordshire, Luton And Milton Keynes Integrated Care Board"
DT301,HERTS URGENT CARE (ASCOTS LANE),Other provider,,East of England Commissioning Region,,202104,202606,0,false,QM7,NHS Hertfordshire And West Essex Integrated Care Board,QM7,NHS Hertfordshire And West Essex Integrated Care Board
NQT1I,CHIPPENHAM COMMUNITY HOSPITAL,Other provider,,South West Commissioning Region,,202505,202606,0,false,QOX,"NHS Bath And North East Somerset, Swindon And Wiltshire Integrated Care Board",,
Y03051,HASTINGS MED P & WALKIN,Other provider,,NHS ENGLAND SOUTH EAST,,202104,202204,0,false,,,,
NTV0B,ASHFORD WALK-IN-CENTRE,Other provider,,NHS ENGLAND SOUTH EAST,,202104,202606,0,false,,,,
Y00751,EAST BERKS PRIMARY CARE OOH(WAM),Other provider,,NHS ENGLAND SOUTH EAST,,202104,202509,0,false,,,,
AXG,WILTSHIRE HEALTH & CARE,Other provider,,NHS ENGLAND SOUTH WEST,,202104,202502,0,false,,,,
NJS05,LOUGHBOROUGH URGENT CARE CENTRE,Other provider,,NHS ENGLAND MIDLANDS,,202104,202204,0,false,,,,
Y02816,EASTBOURNE STATION HEALTH CENTRE,Other provider,,NHS ENGLAND SOUTH EAST,,202104,202108,0,false,,,,
NQ106,FRYATT HOSPITAL,Other provider,,NHS ENGLAND EAST OF ENGLAND,,202105,202108,0,false,,,,
NQT51,STATION PLAZA HEALTH CENTRE,Other provider,,NHS ENGLAND SOUTH EAST,,202205,202509,0,false,,,,
NQT10,ASSURA READING LLP,Other provider,,NHS ENGLAND SOUTH EAST,,202104,202303,0,false,,,,
RV9,HUMBER TEACHING NHS FOUNDATION TRUST,NHS Trust,HU10 6ED,North East and Yorkshire,true,202104,202606,0,false,QOQ,NHS Humber And North Yorkshire Integrated Care Board,QOQ,NHS Humber And North Yorkshire Integrated Care Board
RW1,HAMPSHIRE AND ISLE OF WIGHT HEALTHCARE NHS FOUNDATION TRUST,NHS Trust,SO40 2RZ,South East,true,202104,202606,0,false,QRL,NHS Hampshire And Isle Of Wight Integrated Care Board,QRL,NHS Hampshire And Isle Of Wight Integrated Care Board
RBK,WALSALL HEALTHCARE NHS TRUST,NHS Trust,WS2 9PS,Midlands,true,202104,202606,63,true,QUA,NHS Black Country Integrated Care Board,QUA,NHS Black Country Integrated Care Board
RAN,ROYAL NATIONAL ORTHOPAEDIC HOSPITAL NHS TRUST,NHS Trust,HA7 4LP,London,true,202104,202606,0,false,QMJ,NHS North Central London Integrated Care Board,QMJ,NHS North Central London Integrated Care Board
RH5,SOMERSET NHS FOUNDATION TRUST,NHS Trust,TA1 5DA,South West,true,202104,202606,63,true,QSL,NHS Somerset Integrated Care Board,QSL,NHS Somerset Integrated Care Board
RXK,SANDWELL AND WEST BIRMINGHAM HOSPITALS NHS TRUST,NHS Trust,B66 2QT,Midlands,true,202104,202606,63,true,QUA,NHS Black Country Integrated Care Board,QUA,NHS Black Country Integrated Care Board
RLQ,WYE VALLEY NHS TRUST,NHS Trust,HR1 2ER,Midlands,true,202104,202606,63,true,QGH,NHS Herefordshire And Worcestershire Integrated Care Board,QGH,NHS Herefordshire And Worcestershire Integrated Care Board
RM1,NORFOLK AND NORWICH UNIVERSITY HOSPITALS NHS FOUNDATION TRUST,NHS Trust,NR4 7UY,East of England,true,202104,202606,63,true,QMM,NHS Norfolk And Waveney Integrated Care Board,QMM,NHS Norfolk And Waveney Integrated Care Board
RN7,DARTFORD AND GRAVESHAM NHS TRUST,NHS Trust,DA2 8DA,South East,true,202104,202606,63,true,QKS,NHS Kent And Medway Integrated Care Board,QKS,NHS Kent And Medway Integrated Care Board
RWD,UNITED LINCOLNSHIRE TEACHING HOSPITALS NHS TRUST,NHS Trust,LN2 5QY,Midlands,true,202104,202606,63,true,QJM,NHS Lincolnshire Integrated Care Board,QJM,NHS Lincolnshire Integrated Care Board
RJ1,GUY'S AND ST THOMAS' NHS FOUNDATION TRUST,NHS Trust,SE1 7EH,London,true,202104,202606,63,true,QKK,NHS South East London Integrated Care Board,QKK,NHS South East London Integrated Care Board
RKE,WHITTINGTON HEALTH NHS TRUST,NHS Trust,N19 5NF,London,true,202104,202606,63,true,QMJ,NHS North Central London Integrated Care Board,QMJ,NHS North Central London Integrated Care Board
RWJ,STOCKPORT NHS FOUNDATION TRUST,NHS Trust,SK2 7JE,North West,true,202104,202606,63,true,QOP,NHS Greater Manchester Integrated Care Board,QOP,NHS Greater Manchester Integrated Care Board
Y03571,CORBY URGENT CARE CENTRE,Other provider,,Midlands Commissioning Region,,202104,202402,0,false,QPM,NHS Northamptonshire Integrated Care Board,QPM,NHS Northamptonshire Integrated Care Board
Y04538,BRACKNELL URGENT CARE CENTRE WIC,Other provider,,South East Commissioning Region,,202104,202401,0,false,QNQ,NHS Frimley Integrated Care Board,QNQ,NHS Frimley Integrated Care Board
RTP,SURREY AND SUSSEX HEALTHCARE NHS TRUST,NHS Trust,RH1 5RH,South East,true,202104,202606,63,true,QXU,NHS Surrey Heartlands Integrated Care Board,QXU,NHS Surrey Heartlands Integrated Care Board
RCX,"THE QUEEN ELIZABETH HOSPITAL, KING'S LYNN, NHS FOUNDATION TRUST",NHS Trust,PE30 4ET,East of England,true,202104,202606,63,true,QMM,NHS Norfolk And Waveney Integrated Care Board,QMM,NHS Norfolk And Waveney Integrated Care Board
RJR,COUNTESS OF CHESTER HOSPITAL NHS FOUNDATION TRUST,NHS Trust,CH2 1UL,North West,true,202104,202606,63,true,QYG,NHS Cheshire And Merseyside Integrated Care Board,QYG,NHS Cheshire And Merseyside Integrated Care Board
RNU,OXFORD HEALTH NHS FOUNDATION TRUST,NHS Trust,OX4 4XN,South East,true,202104,202606,0,false,QU9,"NHS Buckinghamshire, Oxfordshire And Berkshire West Integrated Care Board",QU9,"NHS Buckinghamshire, Oxfordshire And Berkshire West Integrated Care Board"
RRF,"WRIGHTINGTON, WIGAN AND LEIGH TEACHING HOSPITALS NHS FOUNDATION TRUST",NHS Trust,WN1 2NN,North West,true,202104,202606,63,true,QOP,NHS Greater Manchester Integrated Care Board,QOP,NHS Greater Manchester Integrated Care Board
RNQ,KETTERING GENERAL HOSPITAL NHS FOUNDATION TRUST,NHS Trust,NN16 8UZ,Midlands,true,202104,202606,63,true,QPM,NHS Northamptonshire Integrated Care Board,QPM,NHS Northamptonshire Integrated Care Board
RBV,THE CHRISTIE NHS FOUNDATION TRUST,NHS Trust,M20 4BX,North West,true,202104,202606,0,false,QOP,NHS Greater Manchester Integrated Care Board,QOP,NHS Greater Manchester Integrated Care Board
RCB,YORK AND SCARBOROUGH TEACHING HOSPITALS NHS FOUNDATION TRUST,NHS Trust,YO31 8HE,North East and Yorkshire,true,202104,202606,63,true,QOQ,NHS Humber And North Yorkshire Integrated Care Board,QOQ,NHS Humber And North Yorkshire Integrated Care Board
R1H,BARTS HEALTH NHS TRUST,NHS Trust,E1 2ES,London,true,202104,202606,63,true,QMF,NHS North East London Integrated Care Board,QMF,NHS North East London Integrated Care Board
RMP,TAMESIDE AND GLOSSOP INTEGRATED CARE NHS FOUNDATION TRUST,NHS Trust,OL6 9RW,North West,true,202104,202606,63,true,QOP,NHS Greater Manchester Integrated Care Board,QOP,NHS Greater Manchester Integrated Care Board
R0A,MANCHESTER UNIVERSITY NHS FOUNDATION TRUST,NHS Trust,M13 9WL,North West,true,202104,202606,63,true,QOP,NHS Greater Manchester Integrated Care Board,QOP,NHS Greater Manchester Integrated Care Board
REM,LIVERPOOL UNIVERSITY HOSPITALS NHS FOUNDATION TRUST,NHS Trust,L7 8XP,North West,true,202104,202606,63,true,QYG,NHS Cheshire And Merseyside Integrated Care Board,QYG,NHS Cheshire And Merseyside Integrated Care Board
NR3,NOTTINGHAM CITYCARE PARTNERSHIP,Other provider,,Midlands Commissioning Region,,202104,202509,0,false,QT1,NHS Nottingham And Nottinghamshire Integrated Care Board,QT1,NHS Nottingham And Nottinghamshire Integrated Care Board
Y02532,MIRIAM MINOR EMERGENCY,Other provider,,North West Commissioning Region,,202104,202606,0,false,QYG,NHS Cheshire And Merseyside Integrated Care Board,QYG,NHS Cheshire And Merseyside Integrated Care Board
G0Q0L,BARKING HOSPITAL UTC,Other provider,,London Commissioning Region,,202304,202606,0,false,QMF,NHS North East London Integrated Care Board,,
RBN,MERSEY AND WEST LANCASHIRE TEACHING HOSPITALS NHS TRUST,NHS Trust,L35 5DR,North West,true,202104,202606,63,true,QYG,NHS Cheshire And Merseyside Integrated Care Board,QYG,NHS Cheshire And Merseyside Integrated Care Board
RQM,CHELSEA AND WESTMINSTER HOSPITAL NHS FOUNDATION TRUST,NHS Trust,SW10 9NH,London,true,202104,202606,63,true,QRV,NHS North West London Integrated Care Board,QRV,NHS North West London Integrated Care Board
RAE,BRADFORD TEACHING HOSPITALS NHS FOUNDATION TRUST,NHS Trust,BD9 6RJ,North East and Yorkshire,true,202104,202606,63,true,QWO,NHS West Yorkshire Integrated Care Board,QWO,NHS West Yorkshire Integrated Care Board
RA2,ROYAL SURREY NHS FOUNDATION TRUST,NHS Trust,GU2 7XX,South East,true,202104,202606,63,true,QXU,NHS Surrey Heartlands Integrated Care Board,QXU,NHS Surrey Heartlands Integrated Care Board
RJ2,LEWISHAM AND GREENWICH NHS TRUST,NHS Trust,SE13 6LH,London,true,202104,202606,63,true,QKK,NHS South East London Integrated Care Board,QKK,NHS South East London Integrated Care Board
RXG,SOUTH WEST YORKSHIRE PARTNERSHIP NHS FOUNDATION TRUST,NHS Trust,WF1 3SP,North East and Yorkshire,true,202104,202606,0,false,QWO,NHS West Yorkshire Integrated Care Board,QWO,NHS West Yorkshire Integrated Care Board
RLT,GEORGE ELIOT HOSPITAL NHS TRUST,NHS Trust,CV10 7DJ,Midlands,true,202104,202606,63,true,QWU,NHS Coventry And Warwickshire Integrated Care Board,QWU,NHS Coventry And Warwickshire Integrated Care Board
RQ3,BIRMINGHAM WOMEN'S AND CHILDREN'S NHS FOUNDATION TRUST,NHS Trust,B4 6NH,Midlands,true,202104,202606,63,true,QHL,NHS Birmingham And Solihull Integrated Care Board,QHL,NHS Birmingham And Solihull Integrated Care Board
RTD,THE NEWCASTLE UPON TYNE HOSPITALS NHS FOUNDATION TRUST,NHS Trust,NE7 7DN,North East and Yorkshire,true,202104,202606,63,true,QHM,NHS North East And North Cumbria Integrated Care Board,QHM,NHS North East And North Cumbria Integrated Care Board
RYJ,IMPERIAL COLLEGE HEALTHCARE NHS TRUST,NHS Trust,W2 1BL,London,true,202104,202606,63,true,QRV,NHS North West London Integrated Care Board,QRV,NHS North West London Integrated Care Board
RXC,EAST SUSSEX HEALTHCARE NHS TRUST,NHS Trust,TN37 7PT,South East,true,202104,202606,63,true,QNX,NHS Sussex Integrated Care Board,QNX,NHS Sussex Integrated Care Board
8J094,BADGER LTD,Other provider,,Midlands Commissioning Region,,202104,202603,0,false,QHL,NHS Birmingham And Solihull Integrated Care Board,QHL,NHS Birmingham And Solihull Integrated Care Board
C82038,LATHAM HOUSE MEDICAL PRACTICE,Other provider,,Midlands Commissioning Region,,202104,202606,0,false,QK1,"NHS Leicester, Leicestershire And Rutland Integrated Care Board",QK1,"NHS Leicester, Leicestershire And Rutland Integrated Care Board"
NL7,ASSURA VERTIS URGENT CARE CENTRES (BIRMINGHAM),Other provider,,Midlands Commissioning Region,,202104,202603,0,false,QHL,NHS Birmingham And Solihull Integrated Care Board,QHL,NHS Birmingham And Solihull Integrated Care Board
L83087,OKEHAMPTON MEDICAL CENTRE,Other provider,,South West Commissioning Region,,202104,202606,0,false,QJK,NHS Devon Integrated Care Board,QJK,NHS Devon Integrated Care Board
NTP11,PRACTICE PLUS GROUP HOSPITAL - SOUTHAMPTON,Other provider,,South East Commissioning Region,,202104,202606,0,false,QRL,NHS Hampshire And Isle Of Wight Integrated Care Board,QRL,NHS Hampshire And Isle Of Wight Integrated Care Board
ACH01,WHITSTABLE MEDICAL PRACTICE,Other provider,,South East Commissioning Region,,202206,202606,0,false,QKS,NHS Kent And Medway Integrated Care Board,QKS,NHS Kent And Medway Integrated Care Board
NNF16,BRIDLINGTON HOSPITAL,Other provider,,North East and Yorkshire Commissioning Region,,202407,202606,0,false,QOQ,NHS Humber And North Yorkshire Integrated Care Board,,
G3P9C,TROWBRIDGE MINOR INJURIES UNIT,Other provider,,South West Commissioning Region,,202505,202606,0,false,QOX,"NHS Bath And North East Somerset, Swindon And Wiltshire Integrated Care Board",,
AQM01,FAVERSHAM MEDICAL PRACTICE MIU,Other provider,,NHS ENGLAND SOUTH EAST,,202505,202606,0,false,,,,
Y02147,URGENT CARE CENTRE (QMS),Other provider,,NHS ENGLAND LONDON,,202104,202509,0,false,,,,
AC008,ROSSENDALE MINOR INJURIES UNIT,Other provider,,NHS ENGLAND NORTH WEST,,202104,202204,0,false,,,,
RY7,WIRRAL COMMUNITY HEALTH AND CARE NHS FOUNDATION TRUST,NHS Trust,CH42 0LQ,North West,true,202104,202606,0,false,QYG,NHS Cheshire And Merseyside Integrated Care Board,QYG,NHS Cheshire And Merseyside Integrated Care Board
RA9,TORBAY AND SOUTH DEVON NHS FOUNDATION TRUST,NHS Trust,TQ2 7AA,South West,true,202104,202606,63,true,QJK,NHS Devon Integrated Care Board,QJK,NHS Devon Integrated Care Board
REF,ROYAL CORNWALL HOSPITALS NHS TRUST,NHS Trust,TR1 3LJ,South West,true,202104,202606,63,true,QT6,NHS Cornwall And The Isles Of Scilly Integrated Care Board,QT6,NHS Cornwall And The Isles Of Scilly Integrated Care Board
RWA,HULL UNIVERSITY TEACHING HOSPITALS NHS TRUST,NHS Trust,HU3 2JZ,North East and Yorkshire,true,202104,202606,63,true,QOQ,NHS Humber And North Yorkshire Integrated Care Board,QOQ,NHS Humber And North Yorkshire Integrated Care Board
RYR,UNIVERSITY HOSPITALS SUSSEX NHS FOUNDATION TRUST,NHS Trust,BN11 2DH,South East,true,202104,202606,63,true,QNX,NHS Sussex Integrated Care Board,QNX,NHS Sussex Integrated Care Board
RWG,WEST HERTFORDSHIRE TEACHING HOSPITALS NHS TRUST,NHS Trust,WD18 0HB,East of England,true,202104,202606,63,true,QM7,NHS Hertfordshire And West Essex Integrated Care Board,QM7,NHS Hertfordshire And West Essex Integrated Care Board
R0B,SOUTH TYNESIDE AND SUNDERLAND NHS FOUNDATION TRUST,NHS Trust,SR4 7TP,North East and Yorkshire,true,202104,202606,63,true,QHM,NHS North East And North Cumbria Integrated Care Board,QHM,NHS North East And North Cumbria Integrated Care Board
RF4,"BARKING, HAVERING AND REDBRIDGE UNIVERSITY HOSPITALS NHS TRUST",NHS Trust,RM7 0AG,London,true,202104,202606,63,true,QMF,NHS North East London Integrated Care Board,QMF,NHS North East London Integrated Care Board
C83023,SLEAFORD MEDICAL GROUP,Other provider,,Midlands Commissioning Region,,202104,202606,0,false,QJM,NHS Lincolnshire Integrated Care Board,QJM,NHS Lincolnshire Integrated Care Board
DD401,EXMOUTH MINOR INJURY UNIT,Other provider,,South West Commissioning Region,,202104,202312,0,false,QJK,NHS Devon Integrated Care Board,QJK,NHS Devon Integrated Care Board
NNF94,EAST RIDING COMMUNITY HOSPITAL,Other provider,,North East and Yorkshire Commissioning Region,,202104,202606,0,false,QOQ,NHS Humber And North Yorkshire Integrated Care Board,QOQ,NHS Humber And North Yorkshire Integrated Care Board
NV693,ROSSENDALE MIU & OOH,Other provider,,North West Commissioning Region,,202205,202606,0,false,QE1,NHS Lancashire And South Cumbria Integrated Care Board,QE1,NHS Lancashire And South Cumbria Integrated Care Board
NNJ11,LUTTERWORTH HOSPITAL,Other provider,,Midlands Commissioning Region,,202603,202606,0,false,QK1,"NHS Leicester, Leicestershire And Rutland Integrated Care Board",,
G82071,WHITSTABLE MEDICAL PRACTICE,Other provider,,NHS ENGLAND SOUTH EAST,,202104,202205,0,false,,,,
DFQ,NORWICH & NORFOLK SURGICAL LTD (N2S),Other provider,,,,202104,202605,0,false,,,,
NLE01,LANCASTER HOUSE CONSULTING DIAGNOSTICS SURGICAL LTD HQ,Other provider,,,,202104,202605,0,false,,,,
NPG23,SPAMEDICA DERBY,Other provider,,,,202104,202605,0,false,,,,
NT224,"NUFFIELD HEALTH, WARWICKSHIRE HOSPITAL",Other provider,,,,202104,202605,0,false,,,,
NT226,"NUFFIELD HEALTH, LEICESTER HOSPITAL",Other provider,,,,202104,202605,0,false,,,,
NT308,SPIRE GATWICK PARK HOSPITAL,Other provider,,,,202104,202605,0,false,,,,
NT351,SPIRE HULL AND EAST RIDING HOSPITAL,Other provider,,,,202104,202605,0,false,,,,
NT405,BISHOPS WOOD HOSPITAL,Other provider,,,,202104,202605,0,false,,,,
NT408,CHAUCER HOSPITAL,Other provider,,,,202104,202605,0,false,,,,
NT412,DROITWICH SPA HOSPITAL,Other provider,,,,202104,202605,0,false,,,,
NT445,EDGBASTON HOSPITAL,Other provider,,,,202104,202605,0,false,,,,
NT451,CAVELL HOSPITAL,Other provider,,,,202104,202605,0,false,,,,
NT455,MOUNT ALVERNIA HOSPITAL,Other provider,,,,202104,202605,0,false,,,,
NVC0Y,EXETER MEDICAL,Other provider,,,,202104,202605,0,false,,,,
O5Y9D,SPAMEDICA OXFORD,Other provider,,,,202207,202605,0,false,,,,
G5X2Q,SPAMEDICA NORTH TYNESIDE,Other provider,,,,202309,202605,0,false,,,,
J2H6H,SPAMEDICA COLCHESTER,Other provider,,,,202402,202605,0,false,,,,
G6S7A,SPAMEDICA TAUNTON,Other provider,,,,202408,202605,0,false,,,,
I1H7K,SPAMEDICA SALE,Other provider,,,,202410,202605,0,false,,,,
NNH,OPTEGRA UK,Other provider,,,,202412,202602,0,false,,,,
NQX,PROVIDE ENTERPRISES,Other provider,,,,202504,202605,0,false,,,,
H3W7Q,ACES CHELMSFORD,Other provider,,,,202511,202605,0,false,,,,
W7J4C,ACES MANCHESTER,Other provider,,,,202511,202605,0,false,,,,
P1G3N,ACES LEEDS WHITE ROSE,Other provider,,,,202601,202605,0,false,,,,
D0Y2J,OPTEGRA AT HAVANT HEALTH CENTRE (HAVANT),Other provider,,,,202603,202605,0,false,,,,
E4K5T,OPTEGRA EYE HOSPITAL NEWCASTLE,Other provider,,,,202603,202605,0,false,,,,
ACG24,NEWMEDICA - TEESSIDE - NORTH ORMESBY,Other provider,,,,202104,202605,0,false,,,,
NDL01,SUFFOLK GP FEDERATION,Other provider,,,,202104,202603,0,false,,,,
NPG08,SPAMEDICA BOLTON,Other provider,,,,202104,202605,0,false,,,,
NPG12,SPAMEDICA ECCLESHILL TREATMENT CENTRE,Other provider,,,,202104,202306,0,false,,,,
NT237,"NUFFIELD HEALTH, TEES HOSPITAL",Other provider,,,,202104,202605,0,false,,,,
NT30A,SPIRE NOTTINGHAM HOSPITAL,Other provider,,,,202104,202605,0,false,,,,
NT315,SPIRE BUSHEY HOSPITAL,Other provider,,,,202104,202605,0,false,,,,
NT403,BEARDWOOD HOSPITAL,Other provider,,,,202104,202605,0,false,,,,
NT430,RIDGEWAY HOSPITAL,Other provider,,,,202104,202605,0,false,,,,
NTPAE,PRACTICE PLUS GROUP OPHTHALMOLOGY - NORTH WEST,Other provider,,,,202104,202605,0,false,,,,
NVC02,THE BERKSHIRE INDEPENDENT HOSPITAL,Other provider,,,,202104,202605,0,false,,,,
NVC04,DUCHY HOSPITAL,Other provider,,,,202104,202605,0,false,,,,
NVC09,NEW HALL HOSPITAL,Other provider,,,,202104,202605,0,false,,,,
NVC0R,TEES VALLEY HOSPITAL,Other provider,,,,202104,202605,0,false,,,,
NX5,ANGLIA COMMUNITY EYE SERVICE LTD,Other provider,,,,202104,202510,0,false,,,,
NXM01,THE HORDER CENTRE - ST JOHNS ROAD,Other provider,,,,202104,202605,0,false,,,,
NXP,INDEPENDENT HEALTH GROUP,Other provider,,,,202104,202605,0,false,,,,
NYW17,ASPEN HEALTHCARE - MIDLAND EYE,Other provider,,,,202104,202501,0,false,,,,
M0N7E,SPAMEDICA SITTINGBOURNE,Other provider,,,,202107,202605,0,false,,,,
AAV,COMMUNITY HEALTH AND EYECARE LIMITED,Other provider,,,,202204,202605,0,false,,,,
DFY01,COTSWOLDS SURGICAL PARTNERS,Other provider,,,,202304,202605,0,false,,,,
AY1,MEDEFER,Other provider,,,,202311,202605,0,false,,,,
NRL,HEART NETWORKS,Other provider,,,,202410,202605,0,false,,,,
C9A7J,NEWMEDICA - BRADFORD & HUDDERSFIELD,Other provider,,,,202411,202605,0,false,,,,
AVQ01,ONE ASHFORD HOSPITAL,Other provider,,,,202511,202605,0,false,,,,
G3E7R,OPTEGRA EYE HOSPITAL MAIDSTONE,Other provider,,,,202603,202605,0,false,,,,
NNH03,OPTEGRA (SURREY EYE HOSPITAL),Other provider,,,,202603,202605,0,false,,,,
ACG12,NEWMEDICA COMMUNITY OPHTHALMOLOGY - NORTH EAST LINCOLNSHIRE - GRIMSBY,Other provider,,,,202104,202605,0,false,,,,
AJX,SUSSEX MSK PARTNERSHIP 2,Other provider,,,,202104,202411,0,false,,,,
NCN,DMC HEALTHCARE,Other provider,,,,202104,202605,0,false,,,,
NPG16,SPAMEDICA CHELMSFORD,Other provider,,,,202104,202605,0,false,,,,
NT238,"NUFFIELD HEALTH, TAUNTON HOSPITAL",Other provider,,,,202104,202605,0,false,,,,
NT314,SPIRE LONDON EAST,Other provider,,,,202104,202605,0,false,,,,
NT339,SPIRE REGENCY HOSPITAL,Other provider,,,,202104,202605,0,false,,,,
NT406,BLACKHEATH HOSPITAL,Other provider,,,,202104,202605,0,false,,,,
NT436,SHIRLEY OAKS HOSPITAL,Other provider,,,,202104,202605,0,false,,,,
NT440,THORNBURY HOSPITAL,Other provider,,,,202104,202605,0,false,,,,
NT449,LANCASTER PRIVATE HOSPITAL,Other provider,,,,202104,202605,0,false,,,,
NV1,INHEALTH LIMITED,Other provider,,,,202104,202605,0,false,,,,
P0C3F,SPAMEDICA LEEDS,Other provider,,,,202207,202605,0,false,,,,
DFY02,COTSWOLDS SURGICAL PARTNERS (MELKSHAM),Other provider,,,,202304,202307,0,false,,,,
V5F1D,SPAMEDICA TELFORD,Other provider,,,,202307,202605,0,false,,,,
Z5J5V,SPAMEDICA HAYDOCK,Other provider,,,,202402,202605,0,false,,,,
V8N5R,SPAMEDICA DALSTON,Other provider,,,,202403,202605,0,false,,,,
DJH01,THE ROYAL BUCKINGHAMSHIRE HOSPITAL LTD,Other provider,,,,202409,202605,0,false,,,,
K9J3O,SPAMEDICA LUTON,Other provider,,,,202409,202605,0,false,,,,
V8A3H,SPAMEDICA SHEFFIELD COMMUNITY DIAGNOSTIC & TREATMENT CENTRE,Other provider,,,,202507,202605,0,false,,,,
NP9,BESPOKE HEALTHCARE LTD,Other provider,,,,202509,202605,0,false,,,,
S0L9O,ACES BIRMINGHAM,Other provider,,,,202511,202605,0,false,,,,
Q4W9A,ACES SOUTHAMPTON,Other provider,,,,202512,202605,0,false,,,,
Q6V1S,OPTEGRA EYE HOSPITAL SHEFFIELD,Other provider,,,,202603,202605,0,false,,,,
R1A,HEREFORDSHIRE AND WORCESTERSHIRE HEALTH AND CARE NHS TRUST,NHS Trust,WR5 1JR,Midlands,true,202104,202605,0,false,,,,
RPG,OXLEAS NHS FOUNDATION TRUST,NHS Trust,DA2 7WG,South East,true,202104,202605,0,false,,,,
RW5,LANCASHIRE & SOUTH CUMBRIA NHS FOUNDATION TRUST,NHS Trust,PR5 6AW,North West,true,202104,202605,0,false,,,,
R1L,ESSEX PARTNERSHIP UNIVERSITY NHS FOUNDATION TRUST,NHS Trust,SS11 7XX,East of England,true,202302,202412,0,false,,,,
RX4,"CUMBRIA, NORTHUMBERLAND, TYNE AND WEAR NHS FOUNDATION TRUST",NHS Trust,NE3 3XT,North East and Yorkshire,true,202104,202605,0,false,,,,
RKL,WEST LONDON NHS TRUST,NHS Trust,UB2 4SD,London,true,202104,202405,0,false,,,,
RRE,MIDLANDS PARTNERSHIP UNIVERSITY NHS FOUNDATION TRUST,NHS Trust,ST16 3SR,Midlands,true,202104,202605,0,false,,,,
RV3,CENTRAL AND NORTH WEST LONDON NHS FOUNDATION TRUST,NHS Trust,NW1 3AX,London,true,202104,202502,0,false,,,,
DFY,COTSWOLDS SURGICAL PARTNERS LLP,Other provider,,,,202104,202303,0,false,,,,
NPG17,SPAMEDICA PRESTON,Other provider,,,,202104,202605,0,false,,,,
NT241,"NUFFIELD HEALTH, WOKING HOSPITAL",Other provider,,,,202104,202605,0,false,,,,
NT321,SPIRE LITTLE ASTON HOSPITAL,Other provider,,,,202104,202605,0,false,,,,
NT333,SPIRE WASHINGTON HOSPITAL,Other provider,,,,202104,202605,0,false,,,,
NT347,SPIRE FYLDE COAST HOSPITAL,Other provider,,,,202104,202605,0,false,,,,
